{
  "schemaVersion": "frontier-experiment-receipt-v1",
  "experimentRunId": "run-84b1e28e750d4772addaef2dfbdbe620",
  "campaignId": "frontier-foundation-campaign-1",
  "nativeVersion": "2.56.0",
  "requestId": "sha256:e925acc97f7fa2390823a7902f1c2e4ca37c4c54d8b028989f49860d1ef79f21",
  "leadDigest": "sha256:35c705581ca06d5bef3376c4da40d53e67dde4a893cc6235e887645a2de6f378",
  "claimDigest": "sha256:4891eb9958e8682c0f3dff3f29e6fb20e3206eb546874ea22cfe5fe3571e6af5",
  "sourceDigest": "sha256:67e2e76723555409941d7a67d501d44e835a98a657fa71fbba664bda74255305",
  "targetDigest": "sha256:12519de9523bb54f8129ec3142260db580ca0b3ca8998e09fa6571bb24dfbc68",
  "targetRevision": "6b0b48b681538353c7988c6fed9237d99977fc8d",
  "historyRef": "git:6b0b48b681538353c7988c6fed9237d99977fc8d",
  "protocolDigest": "sha256:40778442774ff85693e77e7ba0a80a81259bd939180e5de0cc35ba5efc07ef74",
  "fixtureDigest": "sha256:deb9f81d78e97c503f48028e4dafb5167ff3b6c966e282e9b1f1c5a77b62c388",
  "result": "inconclusive",
  "outputs": [
    {
      "label": "native",
      "contentDigest": "sha256:58c764494afadfb7885f8052d4121d57cc66aa83cfc254d9a93f065d31d8cc36",
      "path": "generated-output/frontier/git-log-L.execution.json"
    },
    {
      "label": "target",
      "contentDigest": "sha256:7e755aa39c3ec99076b41995cf2378b2da9a9bba45fe618615886c8ef506d4b6",
      "path": "generated-output/frontier/graft-paired-isolated.execution.json"
    }
  ],
  "limitations": [
    "This is an untrusted experiment record, not verifier authentication or public challenge admission.",
    "Paired artifacts alone establish neither comparable performance, superiority nor independent verification; Meta must assess protocol execution and counterevidence."
  ],
  "recordedAtUTC": "2026-10-27T16:47:09.172704Z"
}
